{
  "archetype_id": "TB-A01",
  "version": "1.0.0",
  "name": "Editorial Fashion Motion Portrait",
  "category": "editorial_fashion_portrait",
  "purpose": "Stress-test photographic prompt factors in a production-like fashion scene with visible garment construction, motion, hands, depth, and lighting.",
  "route": "portrait",
  "first_party_baseline_prompt": "Create a full-length editorial fashion portrait of an unmistakably adult model moving through a quiet modern gallery corridor. She is caught mid-turn beside a pale stone bench, wearing a deep teal satin evening dress and carrying a small structured clutch. One hand lightly steadies the clutch while the other hangs naturally after the turn. Tall side windows provide soft directional daylight; a dark doorway occupies the near foreground, the model remains in the midground, and framed architectural details recede into the background. Keep the face natural, the hands fully visible, the garment silhouette readable, and the polished stone floor subtly reflective. Use an 85mm portrait perspective with restrained depth of field and realistic photographic rendering.",
  "source_mechanism_families": [
    {
      "pattern_id": "composition-layered-depth",
      "registry_status": "supported",
      "corpus_observation_count": 12,
      "role": "scene_scaffold"
    },
    {
      "pattern_id": "composition-asymmetric-editorial",
      "registry_status": "observed",
      "corpus_observation_count": 11,
      "role": "scene_scaffold"
    },
    {
      "pattern_id": "lighting-window-side",
      "registry_status": "observed",
      "corpus_observation_count": 12,
      "role": "lighting_scaffold"
    },
    {
      "pattern_id": "interaction-explicit-prop",
      "registry_status": "supported",
      "corpus_observation_count": 12,
      "role": "interaction_scaffold"
    },
    {
      "pattern_id": "material-satin-fold-response",
      "registry_status": "mixed",
      "corpus_observation_count": 12,
      "role": "transfer_stress"
    }
  ],
  "locked_dimensions": [
    "adult subject",
    "gallery corridor",
    "mid-turn action",
    "deep teal satin evening dress",
    "small structured clutch",
    "side-window daylight",
    "foreground/midground/background arrangement",
    "85mm portrait perspective"
  ],
  "allowed_experimental_mutation_points": [
    {
      "mutation_id": "quality_hype",
      "description": "Add or remove low-signal quality wording without changing visible scene geometry.",
      "suitable_experiments": [
        "EXP-007"
      ]
    },
    {
      "mutation_id": "garment_construction",
      "description": "Replace generic garment naming with construction details while preserving garment type, color, and material.",
      "suitable_experiments": [
        "EXP-011"
      ]
    },
    {
      "mutation_id": "fabric_physics",
      "description": "Add motion and fold-response language while preserving pose and garment identity.",
      "suitable_experiments": [
        "EXP-012"
      ]
    }
  ],
  "suitable_experiments": [
    "EXP-007",
    "EXP-011",
    "EXP-012"
  ],
  "unsuitable_experiments": [
    "EXP-013",
    "EXP-014",
    "EXP-015"
  ],
  "expected_evaluation_dimensions": [
    "semantic_compliance",
    "aesthetic_quality",
    "technical_defects",
    "photographic_rendering_quality",
    "garment_construction_fidelity",
    "fabric_motion_coherence"
  ],
  "baseline_prompt_sha256": "bb1988f39afc8237fa7e451342c7ba231d8aed3d0124d4bed71a309281c7864e",
  "provenance": {
    "derivation_method": "mechanism_level_distillation",
    "source_scope": "private_internal_corpus_indexes_and_public_visual_pattern_registry",
    "source_prompt_text_copied": false,
    "source_images_embedded": false,
    "creator_specific_phrasing_retained": false,
    "first_party_prompt": true,
    "publication_safe": true,
    "notes": "The prompt is newly authored for AIPF. Private source material informed mechanism selection only; source wording, prompt IDs, images, and creator-specific composition are not embedded."
  }
}
