{
  "archetype_id": "TB-A09",
  "version": "1.0.0",
  "name": "Independent Adversarial Three-Role Reference Composition",
  "category": "multi_reference_transform",
  "purpose": "Test external validity of explicit identity, outfit, and pose role declarations using an independently constructed adversarial fixture realization with conflict signatures materially different from TB-A08/A02.",
  "route": "reference_transform",
  "first_party_baseline_prompt": "Create a realistic full-body portrait using three project-owned references that deliberately contain conflicting non-target attributes. Use Reference 1 for recognizable identity only, Reference 2 for garment construction and palette only, and Reference 3 for joint arrangement and weight distribution only. Ignore Reference 1 clothing and pose, Reference 2 identity and pose, and Reference 3 identity and wardrobe. Place the final subject in a minimalist studio with a warm-gray backdrop and soft side light. Preserve natural anatomy, a clear garment silhouette, recognizable identity, and the target pose. Do not import the environment from any reference.",
  "baseline_prompt_sha256": "07d1d28d04bceca35044640fc8c504ff35fb9de0d37d2ce74c2e9026ee452fd4",
  "source_mechanism_families": [
    {
      "pattern_id": "reference-identity-isolation",
      "registry_status": "supported",
      "corpus_observation_count": 0,
      "role": "reference_control"
    },
    {
      "pattern_id": "reference-outfit-isolation",
      "registry_status": "supported",
      "corpus_observation_count": 0,
      "role": "reference_control"
    },
    {
      "pattern_id": "reference-pose-isolation",
      "registry_status": "supported",
      "corpus_observation_count": 0,
      "role": "reference_control"
    }
  ],
  "locked_dimensions": [
    "three project-owned A03 adversarial fixtures after freeze",
    "fixed reference ordering",
    "identity target role",
    "outfit target role",
    "pose target role",
    "A03 registered non-target conflict signatures",
    "warm-gray studio",
    "soft side light",
    "full-body portrait"
  ],
  "allowed_experimental_mutation_points": [
    {
      "mutation_id": "adversarial_reference_roles_external_validity",
      "description": "Compare implicit multi-reference use with explicit identity-only, outfit-only, and pose-only role declarations while the same frozen A03 fixture trio and conflict signatures remain identical between conditions.",
      "suitable_experiments": [
        "EXP-018"
      ]
    }
  ],
  "suitable_experiments": [
    "EXP-018"
  ],
  "unsuitable_experiments": [
    "EXP-007",
    "EXP-008",
    "EXP-009",
    "EXP-010",
    "EXP-011",
    "EXP-012",
    "EXP-013",
    "EXP-014",
    "EXP-015",
    "EXP-016",
    "EXP-017"
  ],
  "expected_evaluation_dimensions": [
    "semantic_compliance",
    "aesthetic_quality",
    "technical_defects",
    "reference_role_fidelity",
    "cross_reference_leakage_control"
  ],
  "reference_fixture_policy": "Requires three first-party or project-owned A03 adversarial fixtures with preregistered target roles, materially A02-distinct non-target conflict signatures, frozen hashes, and human acceptance before experiment execution. No private corpus image may be shipped or used as a public benchmark fixture.",
  "provenance": {
    "derivation_method": "mechanism_level_distillation",
    "source_scope": "EXP-016_EXP-017_external_validity_followup_and_public_visual_pattern_registry",
    "source_prompt_text_copied": false,
    "source_images_embedded": false,
    "creator_specific_phrasing_retained": false,
    "first_party_prompt": true,
    "publication_safe": true,
    "notes": "TB-A09 preserves the EXP-016/EXP-017 reference-role mechanism and prompt contrast while changing the frozen fixture realization to test external validity. It does not alter TB-A08 or historical experiment records."
  }
}
