{
  "archetype_id": "TB-A02",
  "version": "1.0.0",
  "name": "Narrative Restoration Studio Portrait",
  "category": "narrative_environmental_portrait",
  "purpose": "Stress-test constraint and emotion wording in a scene with a small action, hand-object interaction, environmental detail, and mixed-source lighting.",
  "route": "new_generation",
  "first_party_baseline_prompt": "Create a realistic environmental portrait of an adult museum conservator in a quiet restoration studio at dusk. She has just paused while placing a small ceramic fragment into a padded tray, with both hands visible near the work surface. A task lamp and fading window light create a controlled warm-cool contrast. A magnifier, soft brush, blank archival tags, and storage drawers establish the work setting without clutter. Frame her slightly off center, with a shelf edge in the foreground, the conservator and tray in the midground, and tall cabinets receding behind her. Keep the scene observational rather than posed, with natural skin, believable hand-object contact, and readable separation between subject and workspace.",
  "source_mechanism_families": [
    {
      "pattern_id": "narrative-micro-action",
      "registry_status": "supported",
      "corpus_observation_count": 12,
      "role": "event_scaffold"
    },
    {
      "pattern_id": "interaction-explicit-prop",
      "registry_status": "supported",
      "corpus_observation_count": 12,
      "role": "interaction_scaffold"
    },
    {
      "pattern_id": "story-environmental-detail",
      "registry_status": "observed",
      "corpus_observation_count": 12,
      "role": "environment_scaffold"
    },
    {
      "pattern_id": "composition-layered-depth",
      "registry_status": "supported",
      "corpus_observation_count": 12,
      "role": "scene_scaffold"
    },
    {
      "pattern_id": "composition-asymmetric-editorial",
      "registry_status": "observed",
      "corpus_observation_count": 11,
      "role": "scene_scaffold"
    }
  ],
  "locked_dimensions": [
    "adult museum conservator",
    "restoration studio",
    "ceramic fragment and padded tray",
    "both hands visible",
    "task lamp plus fading window light",
    "archival work details",
    "foreground/midground/background organization"
  ],
  "allowed_experimental_mutation_points": [
    {
      "mutation_id": "constraint_scope",
      "description": "Swap broad generic negatives for targeted likely failure-mode constraints.",
      "suitable_experiments": [
        "EXP-008"
      ]
    },
    {
      "mutation_id": "emotion_precision",
      "description": "Swap an adjective stack for one precise emotional direction with the same intended affect.",
      "suitable_experiments": [
        "EXP-009"
      ]
    }
  ],
  "suitable_experiments": [
    "EXP-008",
    "EXP-009"
  ],
  "unsuitable_experiments": [
    "EXP-011",
    "EXP-012",
    "EXP-013",
    "EXP-014",
    "EXP-015"
  ],
  "expected_evaluation_dimensions": [
    "semantic_compliance",
    "aesthetic_quality",
    "technical_defects",
    "targeted_failure_mode_control",
    "emotional_specificity"
  ],
  "baseline_prompt_sha256": "41f5c5711f4b8c46c9852818aca700dd3ef195b3ddda4f527d58786df5bc1813",
  "provenance": {
    "derivation_method": "mechanism_level_distillation",
    "source_scope": "private_internal_corpus_indexes_and_public_visual_pattern_registry",
    "source_prompt_text_copied": false,
    "source_images_embedded": false,
    "creator_specific_phrasing_retained": false,
    "first_party_prompt": true,
    "publication_safe": true,
    "notes": "The prompt is newly authored for AIPF. Private source material informed mechanism selection only; source wording, prompt IDs, images, and creator-specific composition are not embedded."
  }
}
