{
  "archetype_id": "TB-A05",
  "version": "1.0.0",
  "name": "Stylized Rooftop Courier Key Art",
  "category": "stylized_game_illustration",
  "purpose": "Stress-test prompt-format transfer in a dense non-photographic scene whose subject, action, lighting, depth, materials, and exclusions can be represented equivalently in prose or structured syntax.",
  "route": "new_generation",
  "first_party_baseline_prompt": "Create a polished fantasy-adventure key-art illustration showing an adult courier crossing a rain-darkened rooftop market at blue hour. She carries a folded map tube, wears a layered travel coat over practical boots, and looks toward a distant signal lantern while wind catches the coat hem. Use a three-quarter full-body view, an asymmetric composition, and clear foreground awning edges, midground character action, and background rooflines. The rendering should feel like high-end game promotional art with controlled painterly edges, selective hard highlights, coherent material separation, and a cool environment punctuated by warm lantern light. Keep the focal hierarchy clear and avoid UI, logos, captions, or decorative text.",
  "source_mechanism_families": [
    {
      "pattern_id": "composition-asymmetric-editorial",
      "registry_status": "observed",
      "corpus_observation_count": 11,
      "role": "scene_scaffold"
    },
    {
      "pattern_id": "composition-layered-depth",
      "registry_status": "supported",
      "corpus_observation_count": 12,
      "role": "scene_scaffold"
    },
    {
      "pattern_id": "narrative-micro-action",
      "registry_status": "supported",
      "corpus_observation_count": 12,
      "role": "event_scaffold"
    },
    {
      "pattern_id": "story-environmental-detail",
      "registry_status": "observed",
      "corpus_observation_count": 12,
      "role": "environment_scaffold"
    },
    {
      "pattern_id": "prompt-targeted-constraints",
      "registry_status": "supported",
      "corpus_observation_count": 12,
      "role": "constraint_scaffold"
    }
  ],
  "locked_dimensions": [
    "adult courier",
    "rain-darkened rooftop market",
    "blue hour",
    "map tube",
    "layered travel coat and boots",
    "signal lantern",
    "wind catching coat hem",
    "three-quarter full-body view",
    "asymmetric layered composition",
    "game key-art rendering"
  ],
  "allowed_experimental_mutation_points": [
    {
      "mutation_id": "prompt_format",
      "description": "Express the same semantic facts as natural-language production prose or JSON-style structured syntax.",
      "suitable_experiments": [
        "EXP-010"
      ]
    }
  ],
  "suitable_experiments": [
    "EXP-010"
  ],
  "unsuitable_experiments": [
    "EXP-011",
    "EXP-012",
    "EXP-013",
    "EXP-014",
    "EXP-015"
  ],
  "expected_evaluation_dimensions": [
    "semantic_compliance",
    "aesthetic_quality",
    "technical_defects",
    "scene_constraint_fidelity"
  ],
  "baseline_prompt_sha256": "a9019c916afe72336a1665708a23d07ee3067b7c35d31ef96b412a9e3fa9e014",
  "provenance": {
    "derivation_method": "mechanism_level_distillation",
    "source_scope": "private_internal_corpus_indexes_and_public_visual_pattern_registry",
    "source_prompt_text_copied": false,
    "source_images_embedded": false,
    "creator_specific_phrasing_retained": false,
    "first_party_prompt": true,
    "publication_safe": true,
    "notes": "The prompt is newly authored for AIPF. Private source material informed mechanism selection only; source wording, prompt IDs, images, and creator-specific composition are not embedded."
  }
}
