{
  "archetype_id": "TB-A04",
  "version": "1.0.0",
  "name": "Porcelain Material Study",
  "category": "artifact_material_study",
  "purpose": "Provide a first-party artifact scene for future transfer replications involving material physics, medium anchoring, artifact state, lighting response, and object-centered composition.",
  "route": "artifact_transform",
  "first_party_baseline_prompt": "Create a museum-style object study of a hand-thrown blue-and-white porcelain ewer on a neutral linen-covered plinth. The vessel has a clearly readable silhouette, a curved handle, a narrow neck, and cobalt underglaze decoration that follows the curvature of the body beneath a translucent glaze. Use soft side lighting to reveal glaze depth, firing softness, minor surface irregularity, and curved-surface distortion of the painted motif without making the object look like glossy plastic. Keep the background quiet and the object centered with enough negative space to inspect its form.",
  "source_mechanism_families": [
    {
      "pattern_id": "material-porcelain-glaze-underglaze",
      "registry_status": "observed",
      "corpus_observation_count": 12,
      "role": "material_anchor"
    },
    {
      "pattern_id": "composition-centered-artifact",
      "registry_status": "hypothesis",
      "corpus_observation_count": 0,
      "role": "scene_scaffold"
    },
    {
      "pattern_id": "lighting-material-specular",
      "registry_status": "hypothesis",
      "corpus_observation_count": 0,
      "role": "lighting_scaffold"
    },
    {
      "pattern_id": "prompt-medium-anchor",
      "registry_status": "observed",
      "corpus_observation_count": 12,
      "role": "prompt_method_context"
    }
  ],
  "locked_dimensions": [
    "single porcelain ewer",
    "blue-and-white underglaze treatment",
    "neutral linen plinth",
    "centered object study",
    "soft side lighting",
    "quiet background"
  ],
  "allowed_experimental_mutation_points": [
    {
      "mutation_id": "material_physics_replication",
      "description": "Reserved transfer slot for a future material-name-only versus visible material-physics replication.",
      "suitable_experiments": []
    },
    {
      "mutation_id": "medium_anchor_replication",
      "description": "Reserved transfer slot for a future medium-name-only versus physical medium-behavior replication.",
      "suitable_experiments": []
    }
  ],
  "suitable_experiments": [],
  "unsuitable_experiments": [
    "EXP-007",
    "EXP-009",
    "EXP-013",
    "EXP-014",
    "EXP-015"
  ],
  "expected_evaluation_dimensions": [
    "semantic_compliance",
    "aesthetic_quality",
    "technical_defects",
    "material_fidelity",
    "artifact_form_fidelity"
  ],
  "baseline_prompt_sha256": "734995e418810fa26bc6c0d955927aec1e354100417b5c4c4bdda51ceb50f06e",
  "provenance": {
    "derivation_method": "mechanism_level_distillation",
    "source_scope": "private_internal_corpus_indexes_and_public_visual_pattern_registry",
    "source_prompt_text_copied": false,
    "source_images_embedded": false,
    "creator_specific_phrasing_retained": false,
    "first_party_prompt": true,
    "publication_safe": true,
    "notes": "The prompt is newly authored for AIPF. Private source material informed mechanism selection only; source wording, prompt IDs, images, and creator-specific composition are not embedded."
  }
}
