{
  "archetype_id": "TB-A08",
  "version": "1.0.0",
  "name": "Adversarial Three-Role Reference Composition",
  "category": "multi_reference_transform",
  "purpose": "Test whether explicit identity, outfit, and pose role declarations reduce cross-reference leakage when every source reference contains deliberately conflicting non-target attributes.",
  "route": "reference_transform",
  "first_party_baseline_prompt": "Create a realistic full-body portrait using three project-owned references that deliberately contain conflicting non-target attributes. Use Reference 1 for recognizable identity only, Reference 2 for garment construction and palette only, and Reference 3 for joint arrangement and weight distribution only. Ignore Reference 1 clothing and pose, Reference 2 identity and pose, and Reference 3 identity and wardrobe. Place the final subject in a minimalist studio with a warm-gray backdrop and soft side light. Preserve natural anatomy, a clear garment silhouette, recognizable identity, and the target pose. Do not import the environment from any reference.",
  "source_mechanism_families": [
    {
      "pattern_id": "reference-identity-isolation",
      "registry_status": "supported",
      "corpus_observation_count": 0,
      "role": "reference_control"
    },
    {
      "pattern_id": "reference-outfit-isolation",
      "registry_status": "supported",
      "corpus_observation_count": 0,
      "role": "reference_control"
    },
    {
      "pattern_id": "reference-pose-isolation",
      "registry_status": "supported",
      "corpus_observation_count": 0,
      "role": "reference_control"
    },
    {
      "pattern_id": "prompt-targeted-constraints",
      "registry_status": "supported",
      "corpus_observation_count": 12,
      "role": "constraint_scaffold"
    }
  ],
  "locked_dimensions": [
    "three project-owned adversarial fixtures",
    "fixed reference ordering",
    "identity target role",
    "outfit target role",
    "pose target role",
    "registered non-target conflict signatures",
    "warm-gray studio",
    "soft side light",
    "full-body portrait"
  ],
  "allowed_experimental_mutation_points": [
    {
      "mutation_id": "adversarial_reference_roles",
      "description": "Compare implicit multi-reference use with explicit identity-only, outfit-only, and pose-only role declarations while the same adversarial reference fixtures and conflict signatures remain frozen.",
      "suitable_experiments": [
        "EXP-016"
      ]
    }
  ],
  "suitable_experiments": [
    "EXP-016"
  ],
  "unsuitable_experiments": [
    "EXP-007",
    "EXP-008",
    "EXP-009",
    "EXP-010",
    "EXP-011",
    "EXP-012",
    "EXP-013",
    "EXP-014",
    "EXP-015"
  ],
  "expected_evaluation_dimensions": [
    "semantic_compliance",
    "aesthetic_quality",
    "technical_defects",
    "reference_role_fidelity",
    "cross_reference_leakage_control"
  ],
  "reference_fixture_policy": "Requires three first-party or project-owned adversarial fixtures whose target role and visually diagnostic non-target conflict attributes are preregistered before fixture generation. No private corpus image may be shipped or used as a public benchmark fixture.",
  "baseline_prompt_sha256": "07d1d28d04bceca35044640fc8c504ff35fb9de0d37d2ce74c2e9026ee452fd4",
  "provenance": {
    "derivation_method": "mechanism_level_distillation",
    "source_scope": "EXP-014_ceiling_followup_and_public_visual_pattern_registry",
    "source_prompt_text_copied": false,
    "source_images_embedded": false,
    "creator_specific_phrasing_retained": false,
    "first_party_prompt": true,
    "publication_safe": true,
    "notes": "TB-A08 is a newly authored adversarial extension of the three-role reference-control mechanism. It does not alter historical TB-A07 or EXP-014 records."
  }
}
